### ISSUE TITLE
client.publish fails

### ISSUE THREAD

**Issue by gilmntg** [knolleary/pubsubclient#216]
Hi,
I'm using publish() method from within an os_timer callback
Return value of the publish is false as if publish failed - however message does arrive to broker.
After few minutes of operation, system crashes...
What am I doing wrong?
Thanks
Gil

**Comment by adaszek** [comment]
I have the same problem. Data is published successfully, but publish(returns) false although state() returns MQTT_CONNECTED. Error occurrence is rather random.

[Here is my implementation where error occures.](https://bitbucket.org/elvisPA/radiosensornet/raw/cc1dc6d44c70dd6041b49292c39f390f5a75dca6/arduinoSensorFirmware/client.ino)

**Comment by adaszek** [comment]
I did a TCP dump from tun interface where my arduino is connected to and there is a correlation between failed publish and TCP ACK for MQTT PING RESPONSE sent from broker:

```
...
"15","17.495376","10.10.3.30","10.10.3.13","MQTT","71","Ping Request, Publish Message"
"16","17.496005","10.10.3.13","10.10.3.30","TCP","40","1883 → 1025 [ACK] Seq=1 Ack=244 Win=28859 Len=0"
"17","17.496099","10.10.3.13","10.10.3.30","MQTT","42","Ping Response"
"18","17.519380","10.10.3.30","10.10.3.13","TCP","40","[TCP ZeroWindow] 1025 → 1883 [ACK] Seq=244 Ack=3 Win=0 Len=0"
"19","17.815883","10.10.3.30","10.10.3.13","MQTT","69","[TCP ZeroWindow] , Publish Message"
"20","17.856177","10.10.3.13","10.10.3.30","TCP","40","1883 → 1025 [ACK] Seq=3 Ack=273 Win=28830 Len=0"
...
```

10.10.3.30 is my arduino. TCP Zero Window means "give me a break" so for some reason arduino is overloaded. From wireshark wiki:

> This means that a client is not able to receive further information at the moment, and the TCP transmission is halted until it can process the information in its receive buffer. 

Any idea what can be the reason or how to debug it further?
