### ISSUE TITLE
problem to connect to mosquitto server

### ISSUE THREAD

**Issue by maw65** [knolleary/pubsubclient#125]
Hi 
I tried you example mqtt_esp2688 and connect to "broker.mqtt-dashboard.com" without any problem.
But when I try to connect to my mosquitto server I get error 4 ( timeout)

I made a tcpdump on my server, it look like this:

"17:04:16.017456 IP DSR-1000N.4097 > 172.17.100.100.1883: Flags [S], seq 6563, win 5840, options [mss 1460], length 0
17:04:16.017788 IP 172.17.100.100.1883 > DSR-1000N.4097: Flags [S.], seq 4294919386, ack 6564, win 29200, options [mss 1460], length 0
17:04:16.023605 IP DSR-1000N.4097 > 172.17.100.100.1883: Flags [.], ack 1, win 5840, length 0
17:04:16.023609 IP DSR-1000N.4097 > 172.17.100.100.1883: Flags [P.], seq 1:18, ack 1, win 5840, length 17
17:04:16.024187 IP 172.17.100.100.1883 > DSR-1000N.4097: Flags [.], ack 18, win 29200, length 0
........................"

when I connect from another client it's like this: (this works)

16:59:55.650254 IP DSR-1000N.58607 > 172.17.100.100.1883: Flags [S], seq 2225566012, win 65535, options [mss 1460,sackOK,TS val 36832968 ecr 0,nop,wscale 6], length 0
16:59:55.650648 IP 172.17.100.100.1883 > DSR-1000N.58607: Flags [S.], seq 3059135654, ack 2225566013, win 28960, options [mss 1460,sackOK,TS val 62002719 ecr 36832968,nop,wscale 6], length 0
16:59:55.657801 IP DSR-1000N.58607 > 172.17.100.100.1883: Flags [.], ack 1, win 1369, options [nop,nop,TS val 36832968 ecr 62002719], length 0
16:59:55.676502 IP DSR-1000N.58607 > 172.17.100.100.1883: Flags [P.], seq 1:37, ack 1, win 1369, options [nop,nop,TS val 36832970 ecr 62002719], length 36

The first massage is quit empty from the esp6288.

If you have any ide what's wrong pls let me know.

/Marcus

**Comment by maw65** [comment]
Hi again

I have solve the issue! my server did not run the last release  3.1.1.

/Marcus
