### ISSUE TITLE
Failing to publish to MQTT from Arduino

### ISSUE THREAD

**Issue by marcelops** [knolleary/pubsubclient#250]
Hello Folks,

I can't get Arduino to publish messages to MQTT via PubSubClient.

Here is the step-by-step of what I tested (this is just my mental algorithm, not the actual code):

- Initialize ESP8266............. [OK]
- Connect to wireless network.... [OK]
- Ping MQTT server from Arduino.. [OK]
- Ping Arduino from laptop....... [OK]
- Connect to MQTT from Arduino... [OK]??
- Publish message to MQTT........ [FAIL]  (no error message)

Here is the environment for the sketch I am showing below:

Structure:  Arduino >> (WiFiEsp + PubSubClient) >> MQTT
Arduino:  **10.0.0.17**
MQTT Server: **10.0.0.234** (Mosquitto, on a local Linux)
Serial port for debugging:  **9600** (Software Serial)
Serial port for ESP8266:  **38400** (Hardware Serial, Arduino Pro Mini, 5V)
Power supply for the ESP8366:  **3.3V**, regulated through LM117

Arduino Sketch:

```
#include "SoftwareSerial.h"
#include "WiFiEsp.h"
#include "PubSubClient.h"

SoftwareSerial mySerial(4, 5); // RX, TX

char ssid[] = "WINNI";
char pwd[] = "password";
int status;

char server[] = "10.0.0.234";

WiFiEspClient client;
PubSubClient mqtt(client);

void setup() {
  mySerial.begin(9600);  // Software serial for Debugging

  Serial.begin(38400);   // Serial for the ESP8266
  WiFi.init(&Serial);

  mySerial.println("Connecting to wireless...");
  while ( status != WL_CONNECTED) {
    status = WiFi.begin(ssid, pwd);
  }

  delay(5000);  // Delay to allow interface to autoconfigure

  mySerial.println(WiFi.status());  // printed multiple times just to make it obvious in the output (for debugging)
  mySerial.println(WiFi.status());
  mySerial.println(WiFi.status());
  mySerial.println(WiFi.status());

  mySerial.println(WiFi.localIP());  // printed multiple times just to make it obvious in the output (for debugging)
  mySerial.println(WiFi.localIP());
  mySerial.println(WiFi.localIP());
  mySerial.println(WiFi.localIP());

  mySerial.println(WiFi.ping("10.0.0.234"));  // ping MQTT server

  client.connect("10.0.0.234", 1883);
  delay(2000);

  mySerial.println("");
  mySerial.println(mqtt.connect("arduino123a"));
  mySerial.println(mqtt.publish("mm/p", "Message to MQTT"));

}

void loop() {

}

```
Output of SoftwareSerial  (baud rate:  9600)

```
Connecting to wireless...
1
1
1
1
10.0.0.17
10.0.0.17
10.0.0.17
10.0.0.17
1

1
1

```
Output of Hardware Serial (baud rate: 38400)

```
AT
AT+RST
ATE0
AT+CWMODE=1
AT+CIPMUX=1
AT+CIPDINFO=1
AT+CWAUTOCONN=0
AT+CWDHCP=1,1
AT+GMR
[WiFiEsp] Initilization successful - 2.0.0
AT+CWJAP_CUR="WINNI","password"
[WiFiEsp] Connected to WINNI
AT+CIPSTATUS
AT+CIPSTATUS
AT+CIPSTATUS
AT+CIPSTATUS
AT+CIFSR
AT+CIFSR
AT+CIFSR
AT+CIFSR
AT+PING="10.0.0.234"
[WiFiEsp] Connecting to 10.0.0.234
AT+CIPSTART=3,"TCP","10.0.0.234",1883
AT+CIPSTATUS
AT+CIPSTATUS
AT+CIPSEND=3,19
0�mm/pMessage to MQTT

```
On the MQTT server (Linux) I set tcpdump to listen to all conversation with 10.0.0.17 (Arduino):

```
[marcelo@mqtt:~$ sudo tcpdump -n host 10.0.0.17
tcpdump: verbose output suppressed, use -v or -vv for full protocol decode
listening on enp0s3, link-type EN10MB (Ethernet), capture size 262144 bytes
07:46:38.188029 ARP, Request who-has 10.0.0.17 tell 0.0.0.0, length 46
07:46:38.494361 ARP, Request who-has 10.0.0.17 tell 0.0.0.0, length 46
07:46:39.006259 ARP, Request who-has 10.0.0.17 tell 10.0.0.17, length 46
07.46.39.006527 IP 10.0.0.17 > 224.0.0.1: igmp v2 report 224.0.0.1
07:46:39.415817 ARP, Request who-has 10.0.0.234 tell 10.0.0.17, length 46
07:46:45.047714 ARP, Reply 10.0.0.234 is-at 08:00:27:b3:4d:10, length 28
07:46:45.050201 IP 10.0.0.17 > 10.0.0.234: ICMP echo request, id 44975, seq 1, length 40
07:46:45.050222 IP 10.0.0.234 > 10.0.0.17: ICMP echo reply, id 44975, seq 1, length 40
07:46:46.014821 IP 10.0.0.17.41612 > 10.0.0.234.1883: Flags [S], seq 6511, win 2920, options [mss 1460], length 0
07:46:46.014850 IP 10.0.0.234.1883 > 10.0.0.17.41612: Flags [S.], seq 338692666, ack 6512, win 29200, options [mss 1460], length 0
07:46:46.122299 IP 10.0.0.17.41612 > 10.0.0.234.1883: Flags [.], ack 1, win 2920, length 0
07.46.49.073384 IP 10.0.0.17.41612 > 10.0.0.234.1883: Flags [P.], seq 1:20, ack 1, win 2920, length 19
07:46:49.073407 IP 10.0.0.234.1883 > 10.0.0.17.41612: Flags [.], ack 20, win 29200, length 0
07:46:49.073734 IP 10.0.0.234.1883 > 10.0.0.17.41612: Flags [R.], seq 1, ack 20, win 29200, length 0

```
This is the before-after log entries from /var/log/mosquitto/mosquitto.log from the MQTT server, after one run of the sketch described above:

`marcelo@mqtt:~$ cp /var/log/mosquitto/mosquitto.log /tmp/mosquitto.log
`
RUN Arduino sketch once, then...
```
marcelo@mqtt:~$ diff /var/log/mosquitto/mosquitto.log /tmp/mosquitto.log
6847,6849d6846
< 1488458806: New connections from 10.0.0.17 on port 1883.
< 1488458809: Socket error on client <unknown>, disconnecting.

```
Lastly, I have a terminal in my laptop subscribed to the same topic on the MQTT server:

`[marcelo@mqtt]:~$ mosquitto_sub -h 10.0.0.234 -t mm/p`

But nothing ever get published.  If I publish from other devices to that topic, then everything shows, but nothing from the Arduino gets published.

What am I missing?

Thanks,
Marcelo

**Comment by slavino** [comment]
Forget Arduino HW dealing with connection and flash ESP with Arduino code with MQTT stuff. Or if you extremely need Arduino board (due to sensors), just exchange the messages (ESP to Arduino) via serial or whatever other channel of your choice.

**Comment by marcelops** [comment]
@slavino I have at least 5 other sensors in this particular project.  The ESP8266 is just one item of whole project and it is used solely to transmit the collected data to the MQTT broker.

The Arduino is the HW that puts everything together.

As for the following statement:

> just exchange the messages (ESP to Arduino) via serial 

Could you explain a little better (maybe with a few code examples) what you mean by that?

**Comment by slavino** [comment]
pls have a look here for example to get an idea,
http://www.instructables.com/id/Quick-Start-to-Nodemcu-ESP8266-on-Arduino-IDE/

generic ESP board may be flashed with Arduino code as well, you'll only need some 3V3 capable "flasher" (usb to serial)

**Comment by marcelops** [comment]
@slavino Your examples use NodeMCU.  I am not using that.

I am interested in debugging the code that is described in this issue.  Could we please stay on topic?

**Comment by knolleary** [comment]
Hi @marcelops 

you are calling `client.connect` yourself - you don't need to do that as the `mqtt.connect()` command does that for you.

**Comment by marcelops** [comment]
@knolleary In that case, if I remove `client.connect("10.0.0.234", 1883);`, I would need to add `mqtt.setServer("10.0.0.234", 1883);` before `mqtt.connect()`.  Is that correct?

**Comment by knolleary** [comment]
@marcelops yes, that's right. Take a look at the example sketches to see how they do it.

**Comment by slavino** [comment]
@marcelops what I told you was to leave behind the AT config scenario and use ESP-01 (or whichever you use) as standalone WiFi communication capable device flashed with Arduino IDE

I googled it for you: https://create.arduino.cc/projecthub/ROBINTHOMAS/programming-esp8266-esp-01-with-arduino-011389 ... these were my two cents

For me the setup with ESP-01 + Arduino nano/pro (ESP-01 as WiFi serial port via AT commands) didn't work well from stability perspective and got disconnected every several days (sometimes even hours) and I spent too much time inventing recovery scenarios. Therefore the recommendation but the final choice is yours. We all do it for fun ;)

**Comment by marcelops** [comment]
@knolleary I have just tried the following update, but still no success:

Changed the sketch from:
```
  client.connect("10.0.0.234", 1883);
  delay(2000);

  mySerial.println("");
  mySerial.println(mqtt.connect("arduino123a"));
  mySerial.println(mqtt.publish("mm/p", "Message to MQTT"));
```
to:
```
  //client.connect("10.0.0.234", 1883);
  delay(2000);

  mySerial.println("");
  mqtt.setServer("10.0.0.234", 1883);
  mySerial.println(mqtt.connect("arduino123a"));
  mySerial.println(mqtt.publish("mm/p", "Message to MQTT"));
```

There were two differences after that change:

Before, the output of the last two lines (`mqtt.connect()`, and `mqtt.publish()`) were:
```
1
1
```
And now it is:

```
0
0
```

**Comment by marcelops** [comment]
> what I told you was to leave behind the AT config scenario and use ESP-01 (or whichever you use) as standalone WiFi communication capable device flashed with Arduino IDE

@slavino Hi Slavino, I really appreciate your input about NodeMCU, and I will absolutely look into it, and possibly move away from the AT scenario.  Thanks for the link.  I will reading about that solution.  I also do it for fun.

I have been struggling with this issue for several days, and I don't seem to figure the problem out.  I have tried pretty much all examples in the library, and also examples from the internet.  I have re-written my sketch a handful of times already, and still hopeless to have this figured out.  I have even flashed the module with the latest version of the firmware from Espressif.  It works beautifully if I type the AT commands directly to the serial port, or if I ping any hosts.  It just doesn't seem to work for sending messages to a MQTT broker via PubSubClient.

For that reason, I simplified my sketch and elaborated a clear write-up containing only the code necessary to reproduce my error, with the outputs of both serials, and the logs from the MQTT broker, as well as the TCP activity (via tcpdump), and I was hoping someone could help me figure out what is the issue in that sketch.

**Comment by marcelops** [comment]
Maybe the log from mosquitto would provide a clue to what is causing the issue?

```
marcelo@mqtt:~$ tail /var/log/mosquitto/mosquitto.log
New connections from 10.0.0.17 on port 1883.
Socket error on client <unknown>, disconnecting.
```

It seems PubSubClient is not sending the Client ID.

In my sketch, I try connecting to the broker by calling `mqtt.connect("arduino123a")`, but it doesn't seem to be sending **[arduino123a]** as the id for that instance.

**Comment by knolleary** [comment]
That error suggests the TCP connection was made, but the initial CONNECT packet was not sent.

The fact the call to `mqtt.connect("arduino123a")` is returning 0 means the connection has failed.

After it returns 0, the next thing to do is call [`mqtt.state()`](http://pubsubclient.knolleary.net/api.html#state) to find out what error code the connection has failed with.

You can see how the `mqtt_basic` example sketch attempts to connect and properly logs the result: https://github.com/knolleary/pubsubclient/blob/master/examples/mqtt_basic/mqtt_basic.ino#L50

**Comment by marcelops** [comment]
mqtt.state() return -2 for both commands above.

**Comment by marcelops** [comment]
As for wifi library, I am using [WiFiEsp] by bportaluri Version 2.2.1.  Is PubSubClient compatible to this library, or should I try a different library?

**Comment by marcelops** [comment]
@slavino I followed your suggestions, and made substantial progress.  Thank you very much, Slavino.

I removed Arduino and flashed my sketch directly onto the ESP module, changing my HW/SW structure from:

Structure: Arduino >> **(WiFiEsp + PubSubClient) >> MQTT**

to:

Structure: **WiFiEsp + PubSubClient >> MQTT**

@knolleary The issue originally presented in this ticket still remains unsolved, though, because I was trying to send a message from Arduino to the MQTT broker, using the ESP just as a network card, and I wonder if that is even possible.  (The code I described in my original message was being uploaded to the Arduino, not the ESP.)

Here are the bare bones of the sketch that currently works. I am uploading it in the ESP directly (not the Arduino) to use PubSubClient to send messages to the MQTT:

```
#include <ESP8266WiFi.h>
#include "PubSubClient.h"

int status;

WiFiClient client;
PubSubClient mqtt(client);

void setup() {

  Serial.begin(38400);   // Serial for the ESP8266
  WiFi.begin("mywirelessnetwork", "mypassword");

  mqtt.setServer("10.0.0.119", 1883);

  Serial.println("Connecting to the wireless...");
  while ( WiFi.status() != WL_CONNECTED) {
    Serial.print('.');
    delay(500);
  }

  delay(5000);  // Delay to allow interface to autoconfigure

  Serial.println("Connecting to the MQTT broker...");
  mqtt.connect("arduino1234a");
  delay(1000);

  mqtt.publish("mm/p", "Message from ESP8266 to MQTT");

}

void loop() {

}
```

**Comment by hotkeymuc** [comment]
Since this seems to be a common problem when using ESP8266 + Mosquitto broker, I will post my solution here as well since it almost drove me crazy. Not even the example sketches seemed to work across ANY ESP module I tried.

The solution is very unexpected:

Explicitly add a

    WiFi.mode(WIFI_STA);

before

    Wifi.connect(....);

Sounds strange? Yes. Does it fix the problem? Absolutely!
It seems to be an invalid state of the network stack. Explicitly switching to STA mode seems to reset the stack to a sane state.

Hope it helps!

**Comment by amineazatour** [comment]
hi;
i had this problem and i resolve it by changing this command : mqtt.setServer("10.0.0.119", 1883);
by : PubSubClient (server, port, callback, client), to learn more this function you should visit this web site: https://pubsubclient.knolleary.net/api.html#PubSubClient2
and also and this is the most important , you have to disable the firewall of your PC if you use it as a mqtt broker. Good luck
